{
"FunctionInvoke": "F1",
"InvocationID": "000",
"LoggingServer":"S3_A",
"FunctionList":{
        "F1":{
                "FaaSServer":"github_a",
                "Actionname":"faasr",
                "Arguments":{
                        "input1":"input1.csv",
                        "input2":"input2.csv",
                        "output":"output1.csv"
                },
                "InvokeNext":["F3","F2"]
        },
        "F2":{
                "FaaSServer":"github_a",
                "Actionname":"faasr",
                "Arguments":{
                        "input1":"input1.csv",
                        "input2":"output1.csv",
                        "output":"output2.csv"
                },
                "InvokeNext":["F4"]
        },
        "F3":{
                "FaaSServer":"github_a",
                "Actionname":"faasr",
                "Arguments":{
                        "input1":"input2.csv",
                        "input2":"output1.csv",
                        "output":"output3.csv"
                },
                "InvokeNext":["F4"]
        },
        "F4":{
                "FaaSServer":"github_a",
                "Actionname":"faasr",
                "Arguments":{
                        "input1":"output2.csv",
                        "input2":"output3.csv",
                        "output":"output4.csv"
                }
        }
},
"ComputeServers":{
        "github_a":{
                "FaaSType": "GitHubActions",
                "UserName":"yourGithubAccountName",
                "RepoName":"serverless_github_action4",
                "WorkflowName":"main-workflow.yml",
                "Token":"GITHUB_gita_TOKEN",
                "Ref":"main"
        },
        "lambda_a":{
                "FaaSType": "Lambda",
                "Region":"us-east-2",
                "AccessKey":"GITHUB_lambda_ACCESS_KEY",
                "SecretKey":"GITHUB_lambda_SECRET_KEY"
        }
},
"DataStores":{
        "S3_A":{
                "Endpoint":"my_s3",
                "Protocol":"https",
                "AccessKey":"GITHUB_S3_ACCESS_KEY",
                "SecretKey":"GITHUB_S3_SECRET_KEY",
                "Bucket":"4662-east1",
                "Region":"us-east-1",
                "Writable":"TRUE"
        },
        "S3_B":{
            "Endpoint":"my_s3",
            "Protocol":"https",
            "AccessKey":"GITHUB_S3_ACCESS_KEY",
            "SecretKey":"GITHUB_S3_SECRET_KEY",
            "Bucket":"4662-east1",
            "Region":"us-east-1",
            "Writable":"TRUE"
        }
},
"ActionContainers":{
        "f1":"dockerhub_containerX",
        "f2":"dockerhub_containerY",
        "f3":"dockerhub_containerX"
        }
}